{
  "$schema": "http://json-schema.org/draft-06/schema#",
  "id": "http://hl7.org/fhir/json-schema/MedicationRequest",
  "description": "An order or request for both supply of the medication and the instructions for administration of the medication to a patient.",
  "type": "object",
  "required": ["resourceType", "status", "intent", "subject"],
  "properties": {
    "resourceType": { "const": "MedicationRequest" },
    "id": { "type": "string", "description": "Logical id of this artifact" },
    "_id": { "type": "string", "description": "MongoDB primary key" },
    "meta": { "type": "object", "properties": { "versionId": { "type": "string" }, "lastUpdated": { "type": "string" }, "source": { "type": "string" }, "profile": { "type": "array", "items": { "type": "string" } }, "security": { "type": "array", "items": { "type": "object", "properties": { "system": { "type": "string" }, "code": { "type": "string" }, "display": { "type": "string" } } } }, "tag": { "type": "array", "items": { "type": "object", "properties": { "system": { "type": "string" }, "code": { "type": "string" }, "display": { "type": "string" } } } } } },
    "implicitRules": { "type": "string" },
    "language": { "type": "string" },
    "text": { "type": "object", "properties": { "status": { "type": "string" }, "div": { "type": "string" } } },
    "contained": { "type": "array", "items": { "type": "object" } },
    "extension": { "type": "array", "items": { "type": "object" } },
    "modifierExtension": { "type": "array", "items": { "type": "object" } },
    "identifier": { "type": "array", "items": { "type": "object", "properties": { "use": { "type": "string" }, "system": { "type": "string" }, "value": { "type": "string" } } } },
    "status": { "type": "string", "enum": ["active", "on-hold", "cancelled", "completed", "entered-in-error", "stopped", "draft", "unknown"] },
    "statusReason": { "type": "object", "properties": { "coding": { "type": "array", "items": { "type": "object", "properties": { "system": { "type": "string" }, "code": { "type": "string" }, "display": { "type": "string" } } } }, "text": { "type": "string" } } },
    "intent": { "type": "string", "enum": ["proposal", "plan", "order", "original-order", "reflex-order", "filler-order", "instance-order", "option"] },
    "category": { "type": "array", "items": { "type": "object", "properties": { "coding": { "type": "array", "items": { "type": "object", "properties": { "system": { "type": "string" }, "code": { "type": "string" }, "display": { "type": "string" } } } }, "text": { "type": "string" } } } },
    "priority": { "type": "string", "enum": ["routine", "urgent", "asap", "stat"] },
    "doNotPerform": { "type": "boolean" },
    "reportedBoolean": { "type": "boolean" },
    "reportedReference": { "type": "object", "properties": { "reference": { "type": "string" }, "display": { "type": "string" } } },
    "medicationCodeableConcept": { "type": "object", "properties": { "coding": { "type": "array", "items": { "type": "object", "properties": { "system": { "type": "string" }, "code": { "type": "string" }, "display": { "type": "string" } } } }, "text": { "type": "string" } } },
    "medicationReference": { "type": "object", "properties": { "reference": { "type": "string" }, "display": { "type": "string" } } },
    "subject": { "type": "object", "properties": { "reference": { "type": "string" }, "display": { "type": "string" } } },
    "encounter": { "type": "object", "properties": { "reference": { "type": "string" }, "display": { "type": "string" } } },
    "supportingInformation": { "type": "array", "items": { "type": "object", "properties": { "reference": { "type": "string" }, "display": { "type": "string" } } } },
    "authoredOn": { "type": "string" },
    "requester": { "type": "object", "properties": { "reference": { "type": "string" }, "display": { "type": "string" } } },
    "performer": { "type": "object", "properties": { "reference": { "type": "string" }, "display": { "type": "string" } } },
    "performerType": { "type": "object", "properties": { "coding": { "type": "array", "items": { "type": "object", "properties": { "system": { "type": "string" }, "code": { "type": "string" }, "display": { "type": "string" } } } }, "text": { "type": "string" } } },
    "recorder": { "type": "object", "properties": { "reference": { "type": "string" }, "display": { "type": "string" } } },
    "reasonCode": { "type": "array", "items": { "type": "object", "properties": { "coding": { "type": "array", "items": { "type": "object", "properties": { "system": { "type": "string" }, "code": { "type": "string" }, "display": { "type": "string" } } } }, "text": { "type": "string" } } } },
    "reasonReference": { "type": "array", "items": { "type": "object", "properties": { "reference": { "type": "string" }, "display": { "type": "string" } } } },
    "instantiatesCanonical": { "type": "array", "items": { "type": "string" } },
    "instantiatesUri": { "type": "array", "items": { "type": "string" } },
    "basedOn": { "type": "array", "items": { "type": "object", "properties": { "reference": { "type": "string" }, "display": { "type": "string" } } } },
    "groupIdentifier": { "type": "object", "properties": { "use": { "type": "string" }, "system": { "type": "string" }, "value": { "type": "string" } } },
    "courseOfTherapyType": { "type": "object", "properties": { "coding": { "type": "array", "items": { "type": "object", "properties": { "system": { "type": "string" }, "code": { "type": "string" }, "display": { "type": "string" } } } }, "text": { "type": "string" } } },
    "insurance": { "type": "array", "items": { "type": "object", "properties": { "reference": { "type": "string" }, "display": { "type": "string" } } } },
    "note": { "type": "array", "items": { "type": "object", "properties": { "text": { "type": "string" }, "time": { "type": "string" }, "authorReference": { "type": "object", "properties": { "reference": { "type": "string" }, "display": { "type": "string" } } }, "authorString": { "type": "string" } } } },
    "dosageInstruction": { "type": "array", "items": { "type": "object", "properties": { "sequence": { "type": "integer" }, "text": { "type": "string" }, "additionalInstruction": { "type": "array", "items": { "type": "object" } }, "patientInstruction": { "type": "string" }, "timing": { "type": "object" }, "asNeededBoolean": { "type": "boolean" }, "asNeededCodeableConcept": { "type": "object" }, "site": { "type": "object" }, "route": { "type": "object" }, "method": { "type": "object" }, "doseAndRate": { "type": "array", "items": { "type": "object" } }, "maxDosePerPeriod": { "type": "object" }, "maxDosePerAdministration": { "type": "object" }, "maxDosePerLifetime": { "type": "object" } } } },
    "dispenseRequest": { "type": "object", "properties": { "initialFill": { "type": "object", "properties": { "quantity": { "type": "object" }, "duration": { "type": "object" } } }, "dispenseInterval": { "type": "object", "properties": { "value": { "type": "number" }, "unit": { "type": "string" }, "system": { "type": "string" }, "code": { "type": "string" } } }, "validityPeriod": { "type": "object", "properties": { "start": { "type": "string" }, "end": { "type": "string" } } }, "numberOfRepeatsAllowed": { "type": "integer" }, "quantity": { "type": "object", "properties": { "value": { "type": "number" }, "unit": { "type": "string" }, "system": { "type": "string" }, "code": { "type": "string" } } }, "expectedSupplyDuration": { "type": "object", "properties": { "value": { "type": "number" }, "unit": { "type": "string" }, "system": { "type": "string" }, "code": { "type": "string" } } }, "performer": { "type": "object", "properties": { "reference": { "type": "string" }, "display": { "type": "string" } } } } },
    "substitution": { "type": "object", "properties": { "allowedBoolean": { "type": "boolean" }, "allowedCodeableConcept": { "type": "object" }, "reason": { "type": "object", "properties": { "coding": { "type": "array", "items": { "type": "object", "properties": { "system": { "type": "string" }, "code": { "type": "string" }, "display": { "type": "string" } } } }, "text": { "type": "string" } } } } },
    "priorPrescription": { "type": "object", "properties": { "reference": { "type": "string" }, "display": { "type": "string" } } },
    "detectedIssue": { "type": "array", "items": { "type": "object", "properties": { "reference": { "type": "string" }, "display": { "type": "string" } } } },
    "eventHistory": { "type": "array", "items": { "type": "object", "properties": { "reference": { "type": "string" }, "display": { "type": "string" } } } }
  }
}
