{
  "resourceType": "MedicationRequest",
  "id": "bsj1-smp-medrx-calcium-0-3",
  "text": {
    "status": "generated",
    "div": "<div xmlns=\"http://www.w3.org/1999/xhtml\"><p class=\"res-header-id\"><b>Generated Narrative: MedicationRequest bsj1-smp-medrx-calcium-0-3</b></p><a name=\"bsj1-smp-medrx-calcium-0-3\"> </a><a name=\"hcbsj1-smp-medrx-calcium-0-3\"> </a><p><b>status</b>: Stopped</p><p><b>intent</b>: Order</p><p><b>medication</b>: <span title=\"Codes:{http://www.nlm.nih.gov/research/umls/rxnorm 282465}, {http://hl7.org/fhir/sid/ndc 63629-2600-1}\">calcium carbonate 1250 MG Oral Tablet</span></p><p><b>subject</b>: <a href=\"Patient-patient-betsysmith-johnson01.html\">Betsy Smith-Johnson</a></p><p><b>authoredOn</b>: 2025-04-22 09:30:00-0800</p><p><b>requester</b>: <a href=\"PractitionerRole-Role-IMMD-AnitaChu.html\">PractitionerRole Primary care provider (occupation)</a></p></div>"
  },
  "status": "stopped",
  "intent": "order",
  "medicationCodeableConcept": {
    "coding": [
      {
        "system": "http://www.nlm.nih.gov/research/umls/rxnorm",
        "code": "282465",
        "display": "calcium carbonate 1250 MG Oral Tablet"
      },
      {
        "system": "http://hl7.org/fhir/sid/ndc",
        "code": "63629-2600-1"
      }
    ]
  },
  "subject": {
    "reference": "Patient/patient-betsysmith-johnson01",
    "display": "Betsy Smith-Johnson"
  },
  "authoredOn": "2025-04-22T09:30:00-08:00",
  "requester": {
    "reference": "PractitionerRole/Role-IMMD-AnitaChu"
  }
}