{
  "resourceType": "MedicationRequest",
  "id": "bsj1-smp-medrx-lipitor-2-2",
  "text": {
    "status": "generated",
    "div": "<div xmlns=\"http://www.w3.org/1999/xhtml\"><p class=\"res-header-id\"><b>Generated Narrative: MedicationRequest bsj1-smp-medrx-lipitor-2-2</b></p><a name=\"bsj1-smp-medrx-lipitor-2-2\"> </a><a name=\"hcbsj1-smp-medrx-lipitor-2-2\"> </a><p><b>status</b>: Active</p><p><b>intent</b>: Order</p><p><b>medication</b>: <span title=\"Codes:{http://www.nlm.nih.gov/research/umls/rxnorm 617320}, {http://hl7.org/fhir/sid/ndc 0071-0157-23}\">atorvastatin 40 MG Oral Tablet</span></p><p><b>subject</b>: <a href=\"Patient-patient-betsysmith-johnson01.html\">Betsy Smith-Johnson</a></p><p><b>authoredOn</b>: 2025-07-01 16:15:00-0800</p><p><b>requester</b>: <a href=\"PractitionerRole-PractitionerRole-MD-HemaOnko.html\">PractitionerRole Internal Medicine Physician</a></p></div>"
  },
  "status": "active",
  "intent": "order",
  "medicationCodeableConcept": {
    "coding": [
      {
        "system": "http://www.nlm.nih.gov/research/umls/rxnorm",
        "code": "617320",
        "display": "atorvastatin 40 MG Oral Tablet"
      },
      {
        "system": "http://hl7.org/fhir/sid/ndc",
        "code": "0071-0157-23"
      }
    ]
  },
  "subject": {
    "reference": "Patient/patient-betsysmith-johnson01",
    "display": "Betsy Smith-Johnson"
  },
  "authoredOn": "2025-07-01T16:15:00-08:00",
  "requester": {
    "reference": "PractitionerRole/PractitionerRole-MD-HemaOnko"
  }
}