{
  "resourceType": "MedicationRequest",
  "id": "bsj1-smp-medrx-insulin-2-11",
  "text": {
    "status": "generated",
    "div": "<div xmlns=\"http://www.w3.org/1999/xhtml\"><p class=\"res-header-id\"><b>Generated Narrative: MedicationRequest bsj1-smp-medrx-insulin-2-11</b></p><a name=\"bsj1-smp-medrx-insulin-2-11\"> </a><a name=\"hcbsj1-smp-medrx-insulin-2-11\"> </a><p><b>status</b>: Active</p><p><b>intent</b>: Order</p><p><b>medication</b>: <span title=\"Codes:{http://www.nlm.nih.gov/research/umls/rxnorm 311048}, {http://hl7.org/fhir/sid/ndc 71093-143-11}\">insulin isophane, human 70 UNT/ML / insulin, regular, human 30 UNT/ML Injectable Suspension</span></p><p><b>subject</b>: <a href=\"Patient-patient-betsysmith-johnson01.html\">Betsy Smith-Johnson</a></p><p><b>authoredOn</b>: 2025-07-02 13:00:00-0800</p><p><b>requester</b>: <a href=\"PractitionerRole-PractitionerRole-MD-HemaOnko.html\">PractitionerRole Internal Medicine Physician</a></p></div>"
  },
  "status": "active",
  "intent": "order",
  "medicationCodeableConcept": {
    "coding": [
      {
        "system": "http://www.nlm.nih.gov/research/umls/rxnorm",
        "code": "311048",
        "display": "insulin isophane, human 70 UNT/ML / insulin, regular, human 30 UNT/ML Injectable Suspension"
      },
      {
        "system": "http://hl7.org/fhir/sid/ndc",
        "code": "71093-143-11"
      }
    ]
  },
  "subject": {
    "reference": "Patient/patient-betsysmith-johnson01",
    "display": "Betsy Smith-Johnson"
  },
  "authoredOn": "2025-07-02T13:00:00-08:00",
  "requester": {
    "reference": "PractitionerRole/PractitionerRole-MD-HemaOnko"
  }
}